{
  "artifact_contract": {
    "schema_id": "https://rootcellar.dev/schemas/artifacts/v1/batch-policy-escalation.schema.json",
    "schema_version": "1.0.0",
    "compatibility": "backward-additive"
  },
  "escalation_version": 1,
  "generated_at": "2026-03-01T01:02:37.733666+00:00",
  "policy_status": "pass",
  "highest_severity": "info",
  "routing_key": "rootcellar.batch.throughput.policy",
  "owner_policy": {
    "owner_team_default": "rootcellar-core",
    "owner_team_snapshot": "rootcellar-performance",
    "owner_team_dispatch": "rootcellar-reliability",
    "owner_team_ack_retention": "rootcellar-observability",
    "owner_team_policy": "rootcellar-observability",
    "owner_contact_channel": "#rootcellar-oncall",
    "target_p1": "pagerduty://rootcellar-critical",
    "target_p2": "pagerduty://rootcellar-high",
    "target_p3": "slack://rootcellar-alerts",
    "target_info": "slack://rootcellar-observability"
  },
  "summary": {
    "check_count": 7,
    "breach_count": 0,
    "unique_owner_team_count": 3,
    "unique_owner_teams": [
      "rootcellar-observability",
      "rootcellar-performance",
      "rootcellar-reliability"
    ],
    "breach_count_by_team": {},
    "assigned_breach_count": 0,
    "unassigned_breach_count": 0
  },
  "check_assignments": [
    {
      "check_id": "snapshot.status.pass",
      "title": "Snapshot status is pass",
      "status": "pass",
      "severity": "p3",
      "source": "snapshot",
      "message": "Throughput snapshot must remain within thresholds.",
      "observed": "pass",
      "expected": "pass",
      "owner": {
        "team": "rootcellar-performance",
        "queue": "rootcellar-performance-oncall",
        "contact_channel": "#rootcellar-oncall"
      },
      "escalation": {
        "target": "slack://rootcellar-alerts",
        "response_sla_minutes": 240,
        "priority": "p3"
      }
    },
    {
      "check_id": "dispatch.failed_routes.max",
      "title": "Dispatch failed routes within threshold",
      "status": "pass",
      "severity": "p2",
      "source": "dispatch",
      "message": "Failed dispatch routes indicate downstream delivery reliability risk.",
      "observed": 0,
      "expected": {
        "max": 0
      },
      "owner": {
        "team": "rootcellar-reliability",
        "queue": "rootcellar-reliability-oncall",
        "contact_channel": "#rootcellar-oncall"
      },
      "escalation": {
        "target": "pagerduty://rootcellar-high",
        "response_sla_minutes": 60,
        "priority": "p2"
      }
    },
    {
      "check_id": "dispatch.ack_missing.max",
      "title": "Ack-missing routes within threshold",
      "status": "pass",
      "severity": "p2",
      "source": "dispatch",
      "message": "Missing required acknowledgements reduce delivery traceability confidence.",
      "observed": 0,
      "expected": {
        "max": 0
      },
      "owner": {
        "team": "rootcellar-reliability",
        "queue": "rootcellar-reliability-oncall",
        "contact_channel": "#rootcellar-oncall"
      },
      "escalation": {
        "target": "pagerduty://rootcellar-high",
        "response_sla_minutes": 60,
        "priority": "p2"
      }
    },
    {
      "check_id": "dispatch.correlation_mismatch.max",
      "title": "Correlation mismatch routes within threshold",
      "status": "pass",
      "severity": "p2",
      "source": "dispatch",
      "message": "Correlation mismatches prevent deterministic cross-system trace joins.",
      "observed": 0,
      "expected": {
        "max": 0
      },
      "owner": {
        "team": "rootcellar-reliability",
        "queue": "rootcellar-reliability-oncall",
        "contact_channel": "#rootcellar-oncall"
      },
      "escalation": {
        "target": "pagerduty://rootcellar-high",
        "response_sla_minutes": 60,
        "priority": "p2"
      }
    },
    {
      "check_id": "dispatch.replay_metadata.required",
      "title": "Replay metadata present on delivered routes",
      "status": "pass",
      "severity": "p2",
      "source": "dispatch",
      "message": "Replay timestamp/nonce/window fields must be present for delivered routes.",
      "observed": 0,
      "expected": {
        "missing_allowed": 0
      },
      "owner": {
        "team": "rootcellar-reliability",
        "queue": "rootcellar-reliability-oncall",
        "contact_channel": "#rootcellar-oncall"
      },
      "escalation": {
        "target": "pagerduty://rootcellar-high",
        "response_sla_minutes": 60,
        "priority": "p2"
      }
    },
    {
      "check_id": "ack_retention.lookup_coverage.required",
      "title": "Ack retention lookup covers acknowledged routes",
      "status": "pass",
      "severity": "p2",
      "source": "ack_retention_index",
      "message": "Retention lookup count should cover all acknowledged routes.",
      "observed": {
        "ack_received_route_count": 2,
        "ack_lookup_count": 2
      },
      "expected": "ack_lookup_count >= ack_received_route_count",
      "owner": {
        "team": "rootcellar-observability",
        "queue": "rootcellar-observability-oncall",
        "contact_channel": "#rootcellar-oncall"
      },
      "escalation": {
        "target": "pagerduty://rootcellar-high",
        "response_sla_minutes": 60,
        "priority": "p2"
      }
    },
    {
      "check_id": "ack_retention.status.valid",
      "title": "Ack retention index status valid",
      "status": "pass",
      "severity": "p2",
      "source": "ack_retention_index",
      "message": "Ack retention index should not report degraded dispatch availability when dispatch ran.",
      "observed": "ok",
      "expected": "ok|no_ack_records|no_routes",
      "owner": {
        "team": "rootcellar-observability",
        "queue": "rootcellar-observability-oncall",
        "contact_channel": "#rootcellar-oncall"
      },
      "escalation": {
        "target": "pagerduty://rootcellar-high",
        "response_sla_minutes": 60,
        "priority": "p2"
      }
    }
  ],
  "breach_assignments": [],
  "artifact_refs": {
    "policy": "ci-batch-alert-policy-pass-v1.json",
    "dashboard_pack": "ci-batch-dashboard-pack-pass-v1.json"
  },
  "issues": []
}